{
  "schema_version": "2.0",
  "pilot_id": "replace-with-pilot-id",
  "study_stage": "feasibility",
  "plan_sha256": "0000000000000000000000000000000000000000000000000000000000000000",
  "assignment_sha256": "0000000000000000000000000000000000000000000000000000000000000000",
  "observations_sha256": "0000000000000000000000000000000000000000000000000000000000000000",
  "synthetic_example": false,
  "records": [
    {
      "participant_id": "P001",
      "day": 30,
      "due_date": "2026-11-14",
      "status": "scheduled",
      "completed_date": null,
      "workflow_still_in_use": null,
      "protocol_use_frequency": null,
      "would_adopt": null,
      "help_request_count": null,
      "facilitator_support_min": null,
      "cognitive_burden_1_to_7": null,
      "material_error_count": null,
      "safety_event_count": null,
      "local_changes": null,
      "reasons_for_non_use": null
    },
    {
      "participant_id": "P001",
      "day": 90,
      "due_date": "2027-01-13",
      "status": "scheduled",
      "completed_date": null,
      "workflow_still_in_use": null,
      "protocol_use_frequency": null,
      "would_adopt": null,
      "help_request_count": null,
      "facilitator_support_min": null,
      "cognitive_burden_1_to_7": null,
      "material_error_count": null,
      "safety_event_count": null,
      "local_changes": null,
      "reasons_for_non_use": null
    }
  ]
}
